{
  "$schema": "http://json-schema.org/draft-07/schema#",
  "$id": "https://buildo.local/schemas/step-archetype-census.schema.json",
  "title": "Spec 122 §1.10 archetype census — every remaining step, declared",
  "description": "WF1 'conversion roadmap' (2026-09-10). Ask A3's data half: an unconverted or pending file's archetype is DECLARED data, never inferred from its name. Rows cover every one of the 55 currently-unconverted files (scripts/steps/_schema/converted.json is NOT re-listed here — a converted step's own descriptor.identity.archetype is the authoritative source, provenance rule 1) plus the ONE pending file (enrich-parcels.js), which has a real descriptor but is not yet registered in converted.json's own `converted[]` array. archetype is one of the 8 canonical values (Spec 122 §1.10) or the literal string \"UNDECLARED\" — never silently absent (Ask A3: the 36 non-`sources` files have no archetype and no PH-2 risk data yet; ARCH-CENSUS is their own future WF, not this one).",
  "x-ruling": "A1 / A3",
  "type": "object",
  "additionalProperties": false,
  "required": ["$comment", "contract_version", "entries", "exemptions"],
  "properties": {
    "$comment": { "anyOf": [{ "type": "string" }, { "type": "array", "items": { "type": "string" } }] },
    "contract_version": { "const": 1 },
    "entries": {
      "type": "array",
      "minItems": 1,
      "items": { "$ref": "#/definitions/entry" }
    },
    "exemptions": {
      "type": "array",
      "minItems": 1,
      "items": { "$ref": "#/definitions/exemption" },
      "description": "A manifest.scripts slug the conversion programme will never convert is DECLARED here, explicitly, rather than silently dropped from the totality this census/roadmap otherwise enforces. TWO grounds, not one. (a) Ask A2 (operator ruling, 2026-09-10) — no JS file to convert at all: a `.py` step (`python_step_excluded`), or a `coming_soon` entry with file:null (`no_file`). (b) Spec 124 §5 R-AP (2026-09-15) — `runner_owned`: the JS file EXISTS, but the concern it implements belongs to THE RUNNER (Spec 122 §4 / §7.3 concern row 4 / §7.4 A3), which declares nothing per step and cannot be opted out of, so there is no descriptor, no identity.archetype and no x-profile to write. `runner_owned` is the ONLY reason permitted to name a real JS file, and generate-conversion-roadmap.mjs enforces that both directions. Rendered in its own 'Declared exemptions' table by the generator and folded into a slug-grain totality identity — `<manifest slugs> = <converted> + <pending> + <exempted> + <remaining>`, every term DERIVED from its own registry (Spec 124 R-AN), never retyped — so the count is provably exhaustive rather than just the remainder."
    }
  },
  "definitions": {
    "exemption": {
      "type": "object",
      "additionalProperties": false,
      "required": ["slug", "file", "reason", "ruling", "scope"],
      "properties": {
        "slug": {
          "type": "string",
          "pattern": "^[a-z][a-z0-9_]*$",
          "description": "manifest.scripts registry key."
        },
        "file": {
          "type": ["string", "null"],
          "description": "manifest.scripts[slug].file verbatim — a string ending .py, or the literal null a coming_soon entry declares. The generator throws if this disagrees with the live manifest."
        },
        "reason": {
          "type": "string",
          "enum": ["python_step_excluded", "no_file", "runner_owned"],
          "description": "python_step_excluded = operator ruling 2026-09-10: the Python step (aic-orchestrator.py) is EXCLUDED from the conversion programme entirely — not deferred to any future batch, out of the JS step standard's scope by design, stays on its own runner. no_file = a coming_soon manifest entry with file:null — nothing exists yet to convert. runner_owned = Spec 124 §5 R-AP (2026-09-15): the slug HAS a real JS file, but the concern it implements is owned by THE RUNNER (Spec 122 §4 / §7.3 concern row 4 / §7.4 A3) — \"nothing is declared per step, and a step cannot opt out\" — so there is no per-step descriptor, no identity.archetype in step.schema.json's 8-value enum, and no x-profile. It is the ONLY reason that may name a real JS file, and the generator throws both directions (a real JS file under any other reason; a runner_owned row with no real JS file)."
        },
        "ruling": {
          "type": "string",
          "minLength": 1,
          "description": "The operator ruling that made this a permanent exemption, e.g. \"operator 2026-09-10\"."
        },
        "scope": {
          "type": "string",
          "minLength": 1,
          "description": "What the exemption covers / does not cover, e.g. \"out of the JS step standard; stays on its own runner\"."
        },
        "owner_specs": {
          "type": "array",
          "minItems": 1,
          "uniqueItems": true,
          "items": { "type": "string", "pattern": "^docs/specs/[0-9a-z_-]+/[0-9]+[a-z]?_[a-z0-9_]+[.]md$" },
          "description": "Spec 124 (WF2 generated Target Files, 2026-09-29, ruling D2). The spec(s) that OWN this step: each gets the step's generated sub-list inside its `<!-- generated:target-files -->` block (scripts/analysis/generate-target-files.mjs), and fast invariant #43 OWNER-SPEC-DIFF reads its owner set from here (entries AND exemptions), no longer from the system map. Declared DATA, never inferred from a spec's prose. Required (by the generator, not this schema) for every converted/pending row and every sources-chain row; absent on rows outside the generated scope."
        }
      }
    },
    "entry": {
      "type": "object",
      "additionalProperties": false,
      "required": ["slug", "file", "archetype", "batch", "reason"],
      "properties": {
        "slug": {
          "type": "string",
          "pattern": "^[a-z][a-z0-9_]*$",
          "description": "manifest.scripts registry key. A slug with no such key is a schema violation the generator refuses to emit over (never silently skipped)."
        },
        "file": {
          "type": "string",
          "pattern": "^scripts/.*\\.js$",
          "description": "Must equal manifest.scripts[slug].file exactly — the generator throws otherwise (converted ⊆ manifest files, this census's own analogue)."
        },
        "archetype": {
          "type": "string",
          "enum": ["INGESTOR", "MATERIALIZER", "LINK", "MATCHER", "ENRICHER", "BACKFILL", "ASSERT", "RECORDER", "UNDECLARED"],
          "description": "One of Spec 122 §1.10's 8 canonical archetypes, or the literal \"UNDECLARED\" — a real, explicit row stating the census does not (yet) know, never an absent row a reader could mistake for an oversight."
        },
        "batch": {
          "type": "string",
          "enum": ["C1", "C4", "C5", "C6", "pending"],
          "description": "The roadmap batch this file belongs to. \"C1\" = a C1 pilot (pilots 1-8), used only by the eight status:\"converted\" rows authored post-cutover under operator ruling R4 (2026-09-29). \"pending\" is reserved for the ONE file registered in converted.json's pending[] (enrich-parcels.js) — tracked here, not double-counted against the 55 unconverted total."
        },
        "reason": {
          "type": "string",
          "minLength": 1,
          "description": "Why this archetype (or UNDECLARED) — a spec citation, a real descriptor path, or 'deferred to ARCH-CENSUS (Ask A3)'. Required for every row, real archetype or not — mirrors programme-items.json's evidence requirement: a NOT_STARTED/UNDECLARED row still needs the measurement that PROVES the absence, never empty."
        },
        "status": {
          "type": "string",
          "enum": ["converted"],
          "description": "RETENTION (Spec 124 §5 R-AO, added 2026-09-15). Absent = a remaining/pending row, the original shape. `\"converted\"` = the row was RETAINED through cutover instead of deleted. Before this, commit 9 DELETED a slug's census row, which made fast invariant #25 ARCHETYPE-PARITY unreachable for its own founding case: with no row left, `censusArchetype` is null for every converted slug and a valid-but-wrong archetype passes silently (proved by swapping `load_ravines` to ASSERT — still PASS). A retained row's `archetype` is the census's OWN pre-cutover value and MUST NOT be re-derived from the descriptor: the whole point is that #25 compares two independently-authored facts. AMENDED 2026-09-29 (operator ruling R4): a converted row MAY instead be authored POST-cutover, for a slug converted before this retention rule existed (the eight C1 pilots, batch \"C1\"), but only from an independent source — a blind classification of the LEGACY script at its pre-cutover SHA, recorded in `legacy_citation` — never copied from the descriptor. src/tests/census-legacy-citation.infra.test.ts locks that citation. The generator enforces both directions — a `\"converted\"` row whose file is not in converted.json throws, and a row with no `status` whose file IS converted throws."
        },
        "converted_at": {
          "type": "string",
          "minLength": 7,
          "description": "The commit-9 cutover SHA this row was converted at (short or full). Required whenever `status` is `\"converted\"`, forbidden otherwise — a retention claim carries the commit that makes it checkable."
        },
        "legacy_citation": {
          "type": "object",
          "additionalProperties": false,
          "required": ["sha", "path", "cutover_date", "rationale"],
          "properties": {
            "sha": { "type": "string", "pattern": "^[0-9a-f]{7,40}$", "description": "The pre-conversion commit whose blob of `path` was classified (the parent of the step's frozen-shape conversion commit)." },
            "path": { "type": "string", "pattern": "^scripts/.*\\.js$", "description": "The legacy script classified — equals the row's `file`." },
            "cutover_date": { "type": "string", "pattern": "^\\d{4}-\\d{2}-\\d{2}$", "description": "Date of the converted_at cutover commit." },
            "rationale": { "type": "string", "minLength": 20, "description": "What the legacy script reads/writes/does that makes it this archetype." }
          },
          "description": "Operator ruling R4 (2026-09-29): the independent provenance of a converted row authored POST-cutover — the legacy script at its pre-cutover SHA, classified blind before the descriptor's identity.archetype was read. Optional; present only on the eight C1-pilot rows. Locked by src/tests/census-legacy-citation.infra.test.ts (Guardian condition 4)."
        },
        "legacy": {
          "const": "none",
          "description": "Spec 124 R-DK (McDonald's Airtight V3, 2026-10-17): the step is NET-NEW — it has no legacy script, so it has no PRE capture; its G8 reference is its own committed POST. Closed (one value). Checked by scripts/analysis/gates/net-new.mjs: the script has no git history before its descriptor, plus a nonzero recipe (R-CZ), a red-evidence artifact (gate K) and a rerun-zero proof on every POST, or #22 refuses it by name. Mutually exclusive with legacy_citation."
        },
        "spec_diff": {
          "const": "N-A",
          "description": "Spec 124 §5 R-BB (fast invariant #43 OWNER-SPEC-DIFF, 2026-09-29). Declared ONLY on a retained converted row, in the cutover commit, when that commit deliberately touches none/some of the owner specs the system map names for this file. Requires spec_diff_reason. Replaces Spec 123 §7 row 9(b)'s commit-body \"N-A\" convention."
        },
        "spec_diff_reason": {
          "type": "string",
          "minLength": 20,
          "description": "Why the owner specs need no diff (>= 20 chars, mirrored by NA_REASON_MIN in scripts/analysis/gates/owner-spec-diff.mjs). Requires spec_diff."
        },
        "owner_specs": {
          "type": "array",
          "minItems": 1,
          "uniqueItems": true,
          "items": { "type": "string", "pattern": "^docs/specs/[0-9a-z_-]+/[0-9]+[a-z]?_[a-z0-9_]+[.]md$" },
          "description": "Spec 124 (WF2 generated Target Files, 2026-09-29, ruling D2). The spec(s) that OWN this step: each gets the step's generated sub-list inside its `<!-- generated:target-files -->` block (scripts/analysis/generate-target-files.mjs), and fast invariant #43 OWNER-SPEC-DIFF reads its owner set from here (entries AND exemptions), no longer from the system map. Declared DATA, never inferred from a spec's prose. Required (by the generator, not this schema) for every converted/pending row and every sources-chain row; absent on rows outside the generated scope."
        }
      },
      "dependencies": {
        "spec_diff": ["spec_diff_reason", "status"],
        "spec_diff_reason": ["spec_diff"]
      },
      "not": { "required": ["legacy", "legacy_citation"] },
      "$comment": "dependencies -> status works because status's enum is [\"converted\"] only (panel I-5): spec_diff is legal only on a retained converted row."
    }
  }
}
