{
  "$comment": [
    "WF1 \"conversion roadmap\" (2026-09-10). Spec 122 §1.10 archetype census, DECLARED",
    "DATA per the R-T precedent (§10.3) — never name-prefix inference (the defect Ask A6",
    "retires). Rows cover every one of the 55 currently-unconverted files, PLUS the ONE",
    "`pending` file (enrich-parcels.js — a real descriptor exists, commit 7b, but the file",
    "is not yet in converted.json's own `converted[]` array). Rows for already-converted",
    "files were originally deliberately ABSENT — a converted step's own",
    "`descriptor.identity.archetype` is provenance rule 1 (authoritative), so re-declaring",
    "it here would be a second, driftable copy of the same fact.",
    "",
    "REVISED 2026-09-15 (Spec 124 §5 R-AO retention): deletion at cutover made fast",
    "invariant #25 ARCHETYPE-PARITY UNREACHABLE for the very case R-AO exists for — with",
    "no row left, `censusArchetype` is null for every converted slug and a valid-but-wrong",
    "archetype passes silently (proved by swapping `load_ravines` to ASSERT). Cutover now",
    "RETAINS the row with `status: \"converted\"` + `converted_at`. The retained `archetype`",
    "is the census's OWN pre-cutover value, not a copy of the descriptor — that is what",
    "makes #25 a comparison of two independently-authored facts rather than of a value",
    "with itself. MEASURED LIMIT, recorded not papered over: only FOUR of the twelve",
    "already-converted slugs have a pre-cutover archetype anywhere in this file's git",
    "history (enrich_parcels ENRICHER @9f2afcb6, assert_global_coverage ASSERT @272d8ae0,",
    "assert_data_bounds ASSERT @58c35378, assert_engine_health RECORDER @331f97ad). This",
    "census was authored 2026-09-10 as \"the currently-unconverted files\", so the other",
    "eight were ALREADY converted and never had a row; inventing one would fabricate the",
    "exact second copy the paragraph above forbids. Those eight carry no row and #25's",
    "census arm reads not-applicable for them. Every cutover from batch 2 on retains its own.",
    "",
    "archetype is one of the 8 canonical Spec 122 §1.10 values, or the literal string",
    "\"UNDECLARED\" — a real, explicit row, never a silently-absent one. The `sources`",
    "rows carrying a real archetype are the C4 remainder plus C5's 13 conversions.",
    "CORRECTED 2026-09-15 (Spec 124 §5 R-AP, batch-2 Phase 0.8): `reconcile` no longer",
    "has an `entries[]` row at all. It was the 14th C5 slug, declared UNDECLARED with",
    "its own reason; it is now an `exemptions[]` row with `reason: \"runner_owned\"` —",
    "the THIRD exemption class — because the concern it implements is owned by THE",
    "RUNNER (Spec 122 §4 / §7.3 concern row 4 / §7.4 A3), so there is no per-step",
    "descriptor, no `identity.archetype` to pick, and no conversion to do. C5 is",
    "therefore **13** conversions, not 14. The remaining 36 rows (permits/coa/deep_scrapes/",
    "entities+wsib, plus 2 orphan scripts with no manifest.chains membership at all —",
    "`reclassify_all`/`observe_chain`, a genuine finding this WF1 measured and is not",
    "silently folding into any of the plan's named buckets) are UNDECLARED per Ask A3:",
    "the census stops at the 27 `sources` steps; seeding the other 36 is ARCH-CENSUS's",
    "own future WF, run once before C6 opens (Ask A3's own ruling).",
    "",
    "Cross-check the generator performs: every `slug`/`file` pair here must resolve to a",
    "real `manifest.scripts` entry with that exact `file` value (throws otherwise); no",
    "duplicate slugs; every archetype is one of the 9 legal values (schema-enforced)."
  ],
  "contract_version": 1,
  "entries": [
    {"slug":"load_coa_notices","owner_specs":["docs/specs/01-pipeline/129_source_coa_notices.md"],"file":"scripts/load-coa-notices.js","archetype":"INGESTOR","batch":"pending","reason":"NET-NEW step, converted from day one (WF1 load_coa_notices, Spec 129; plan .cursor/wf1_load_coa_notices_active_task.md v3, authorized 2026-10-07). Classified INGESTOR from the plan before any code existed (an external document set acquired and written to one table); there is no legacy script to classify. The one file in converted.json pending[] until its cutover."},
    {
      "slug": "load_bylaw_map_areas",
      "owner_specs": [
        "docs/specs/01-pipeline/58_source_zoning_bylaw.md"
      ],
      "file": "scripts/load-bylaw-map-areas.js",
      "archetype": "INGESTOR",
      "batch": "pending",
      "reason": "RETAINED at cutover per Spec 124 R-AO: archetype and batch are the census's own pre-cutover values, kept verbatim and never re-derived from the descriptor (a copy would make fast invariant #25 compare a value to itself); converted.json registers the file in converted[] and deletes its pending[] entry in the same commit (R-K).",
      "status": "converted",
      "converted_at": "commit-3"
    },
    {
      "slug": "link_parcel_abutments",
      "owner_specs": [
        "docs/specs/01-pipeline/130_link_parcel_abutments.md"
      ],
      "file": "scripts/link-parcel-abutments.js",
      "archetype": "LINK",
      "batch": "pending",
      "reason": "RETAINED at cutover per Spec 124 R-AO: archetype and batch are the census's own pre-cutover values, kept verbatim and never re-derived from the descriptor (a copy would make fast invariant #25 compare a value to itself); converted.json registers the file in converted[] and deletes its pending[] entry in the same commit (R-K).",
      "status": "converted",
      "converted_at": "commit-3"
    },
    {
      "slug": "backfill_realtor_permit_trades",
      "file": "scripts/backfill-realtor-permit-trades.js",
      "archetype": "UNDECLARED",
      "batch": "C6",
      "reason": "Spec 122 §1.10's census covers only the 27 `sources` steps; this file is outside that scope — deferred to ARCH-CENSUS (Ask A3), a dedicated WF before C6 opens"
    },
    {
      "slug": "classify_coa_scope",
      "file": "scripts/classify-coa-scope.js",
      "archetype": "ENRICHER",
      "batch": "pending",
      "reason": "ARCH-CENSUS key-step scope (wave-4 plan .cursor/v3-wave4-coa-and-dispatch-2026-10-18.md, operator y 2026-10-18 recommendation 8; McDonald's Airtight V3) declared ENRICHER; phase-4 wave-4 conversion IN FLIGHT (commit ①, 2026-10-18) — archetype re-derived from the code at PH-0 (R-AO), confirmed ENRICHER: a per-row JS classifier (scripts/lib/coa-scope-classifier.js, scripts/classify-coa-scope.js:177) over its own input table's pending cursor (:165-173) writing six derived columns back onto coa_applications (:134-145). Precedent compute_parcel_cost_estimates (JS per-row compute, one post_commit phase)."
    },
    {
      "slug": "classify_coa_trades",
      "file": "scripts/classify-coa-trades.js",
      "archetype": "MATERIALIZER",
      "batch": "pending",
      "reason": "ARCH-CENSUS wave-4 row (operator y 2026-10-18, plan .cursor/v3-wave4-coa-and-dispatch-2026-10-18.md Q8; McDonald's Airtight V3): MATERIALIZER. Phase-4 wave-4 conversion IN FLIGHT (commit ①, 2026-10-18) — archetype derived from the legacy script at PH-0 (R-AO), never from a descriptor: derived per-lead rows from coa_applications(scope_tags) into lead_trades (INSERT … ON CONFLICT (lead_id, trade_id) DO UPDATE, scripts/classify-coa-trades.js:203-215) and lead_products (per-lead DELETE + INSERT, :228, :241), plus the trade_classified_at watermark (:252). Not an ENRICHER: its outputs are rows of other tables keyed by lead, not columns of the rows it reads (the watermark is the cursor). Twin of compute_trade_forecasts (census MATERIALIZER)."
    },
    {
      "slug": "classify_inspection_status",
      "file": "scripts/classify-inspection-status.js",
      "archetype": "UNDECLARED",
      "batch": "C6",
      "reason": "Spec 122 §1.10's census covers only the 27 `sources` steps; this file is outside that scope — deferred to ARCH-CENSUS (Ask A3), a dedicated WF before C6 opens"
    },
    {
      "slug": "classify_lifecycle_phase",
      "file": "scripts/classify-lifecycle-phase.js",
      "archetype": "UNDECLARED",
      "batch": "C6",
      "reason": "Spec 122 §1.10's census covers only the 27 `sources` steps; this file is outside that scope — deferred to ARCH-CENSUS (Ask A3), a dedicated WF before C6 opens"
    },
    {
      "slug": "classify_permit_phase",
      "file": "scripts/classify-permit-phase.js",
      "archetype": "UNDECLARED",
      "batch": "C6",
      "reason": "Spec 122 §1.10's census covers only the 27 `sources` steps; this file is outside that scope — deferred to ARCH-CENSUS (Ask A3), a dedicated WF before C6 opens"
    },
    {
      "slug": "classify_permits",
      "file": "scripts/classify-permits.js",
      "archetype": "UNDECLARED",
      "batch": "C6",
      "reason": "Spec 122 §1.10's census covers only the 27 `sources` steps; this file is outside that scope — deferred to ARCH-CENSUS (Ask A3), a dedicated WF before C6 opens"
    },
    {
      "slug": "classify_scope",
      "file": "scripts/classify-scope.js",
      "archetype": "UNDECLARED",
      "batch": "C6",
      "reason": "Spec 122 §1.10's census covers only the 27 `sources` steps; this file is outside that scope — deferred to ARCH-CENSUS (Ask A3), a dedicated WF before C6 opens"
    },
    {
      "slug": "close_stale_permits",
      "file": "scripts/close-stale-permits.js",
      "archetype": "UNDECLARED",
      "batch": "C6",
      "reason": "Spec 122 §1.10's census covers only the 27 `sources` steps; this file is outside that scope — deferred to ARCH-CENSUS (Ask A3), a dedicated WF before C6 opens"
    },
    {
      "slug": "compute_build_norms",
      "file": "scripts/compute-build-norms.js",
      "archetype": "UNDECLARED",
      "batch": "C6",
      "reason": "Spec 122 §1.10's census covers only the 27 `sources` steps; this file is outside that scope — deferred to ARCH-CENSUS (Ask A3), a dedicated WF before C6 opens"
    },
    {
      "slug": "compute_coa_cost_estimates",